{"$schema":"../schemas/expert-reference-catalog.schema.json","schema_version":1,"kind":"continuum.expert-reference-catalog","snapshot_date":"2026-07-12","coordination_home":"EndeavorEverlasting/Continuum","tracking_policy":"Internal peers and adopted source concepts use exact commits. External tools that may be installed or cloned must be refreshed against their authoritative source before adoption. A reference never overrides Continuum contracts, repository-owned validators, or application runtime authority.","references":[{"id":"foundry","name":"Foundry","authority_url":"https://github.com/EndeavorEverlasting/foundry","category":"internal_peer","dispositions":["integrate","emulate"],"tracking":"pinned_snapshot","adoption_status":"candidate","authority":"Branch/repository intelligence: Git and provider facts, drift, staleness, capabilities, readiness, storage, and portfolio views.","continuum_role":"Consume read-only recovery candidates and govern replay, provenance, validation, and closure.","adoption_boundary":"Do not duplicate Foundry dashboards/storage or delegate workflow authority to its current no-op policy seam.","observed_ref":"feature/2026-04-25-foundry-release-control-plane@a1f506f3e6fe5d66ca83c722a6484cb735936fd0","risk":"Its default branch is a dated feature branch; no canonical main was resolved. FoundryPolicy is permissive.","next_experiment":"Define a read-only recovery-candidate packet with exact PR/branch/commit/path/hunk/comment provenance.","source_paths":["packages/foundry-git/src/foundry_git/__init__.py","packages/foundry-analysis/src/foundry_analysis/__init__.py","packages/foundry-policy/src/foundry_policy/__init__.py","foundry_product_blueprint.md"]},{"id":"blacksmith-guild","name":"The Blacksmith Guild","authority_url":"https://github.com/EndeavorEverlasting/BlacksmithGuild","category":"internal_peer","dispositions":["integrate","reference_only"],"tracking":"pinned_snapshot","adoption_status":"active","authority":"Application runtime policy, adapters, proof taxonomy, validators, and TbgContinuumCapabilityPacket producer.","continuum_role":"Import proven generic capability descriptions read-only after extraction gates.","adoption_boundary":"Gameplay, launcher, save, route, trade, economy, smithing, and runtime authority remain app-owned.","observed_ref":"main@75078deba98dd8d7133e175c9195e8aa94012c4c","risk":"Large open/stacked PR inventory; active runtime lanes are not stale-replay inputs.","next_experiment":"Import TbgContinuumCapabilityPacket.v1 read-only before extracting implementation.","source_paths":[".tbg/workflows/continuum-interoperability.contract.json",".tbg/plans/stale-pr-recovery-20260712/manifest.json",".tbg/workflows/stale-pr-recovery-automation.contract.json"]},{"id":"wezterm","name":"WezTerm","authority_url":"https://github.com/wezterm/wezterm","category":"operator_environment","dispositions":["use","emulate","reference_only"],"tracking":"pinned_snapshot","adoption_status":"active","authority":"Terminal, multiplexer, pane, tab, window, and domain runtime behavior.","continuum_role":"Emulate named-domain capability/lifecycle boundaries; use as an optional operator shell.","adoption_boundary":"Do not vendor terminal runtime code or claim state without independent observation.","observed_ref":"fff02ca501c3b457f99b467a86061d2b150c51f2","risk":"Provider integration can collapse operator ergonomics, execution, and proof into one unsafe surface.","next_experiment":"Disposition Continuum PR #5 before a read-only state observer.","source_paths":["mux/src/domain.rs","lua-api-crates/mux/src/domain.rs","wezterm-client/src/domain.rs","docs/multiplexing.md"]},{"id":"tmux","name":"tmux","authority_url":"https://github.com/tmux/tmux/wiki","category":"operator_environment","dispositions":["use","emulate","reference_only"],"tracking":"follow_latest_before_adoption","adoption_status":"candidate","authority":"Server, session, window, pane, and client lifecycle.","continuum_role":"Optional session backend and durable attach/detach prior art.","adoption_boundary":"Pane/session presence never proves command or application success.","observed_ref":"authoritative wiki reviewed 2026-07-12","risk":"Session presence can be mistaken for process health.","next_experiment":"Define a provider-neutral session snapshot first."},{"id":"neovim","name":"Neovim","authority_url":"https://neovim.io/","category":"operator_environment","dispositions":["use","reference_only"],"tracking":"local_install","adoption_status":"reference_only","authority":"Editor, buffer, LSP, and user-configuration behavior.","continuum_role":"Expose compact files, commands, diagnostics, and task packets.","adoption_boundary":"Do not vendor personal configuration or treat editor state as proof.","observed_ref":"official site reviewed 2026-07-12","risk":"Machine-local plugins can become false repo dependencies.","next_experiment":"Keep integration operator-local until the command surface stabilizes."},{"id":"skills-cli","name":"Vercel Labs skills CLI","authority_url":"https://github.com/vercel-labs/skills","category":"agent_tooling","dispositions":["use","integrate","emulate"],"tracking":"follow_latest_before_adoption","adoption_status":"candidate","authority":"Agent-skill installation, discovery, updates, and distribution conventions.","continuum_role":"Publish narrow project-local skills that route agents to contracts.","adoption_boundary":"Skill text is guidance, not execution authority; review sources before use.","observed_ref":"authoritative repository reviewed 2026-07-12","risk":"Broad installs expand prompt and trust surfaces.","next_experiment":"Package one read-only repo-floor skill and test install/discovery/removal."},{"id":"open-super-whisper","name":"OpenSuperWhisper","authority_url":"https://github.com/starmel/OpenSuperWhisper","category":"voice_input","dispositions":["use","reference_only","defer"],"tracking":"follow_latest_before_adoption","adoption_status":"deferred","authority":"macOS dictation and transcription behavior.","continuum_role":"Accept dictated text only as untrusted operator input.","adoption_boundary":"Voice input cannot bypass scope, confirmation, provenance, or validation.","observed_ref":"release 0.1.0 observed 2026-07-12","risk":"Primary operator environment is Windows; transcription errors can become unsafe instructions.","next_experiment":"Keep a provider-neutral voice-input boundary and defer adoption."},{"id":"axi","name":"Agent eXperience Interface","authority_url":"https://axi.md/","category":"interface_standard","dispositions":["emulate","integrate","reference_only"],"tracking":"website_spec","adoption_status":"candidate","authority":"Agent-oriented CLI principles and compact structured interfaces.","continuum_role":"Use stable identifiers, bounded output, discovery, and progressive disclosure.","adoption_boundary":"Token efficiency cannot weaken evidence or human-readable reporting.","observed_ref":"official specification reviewed 2026-07-12","risk":"Over-optimization can make evidence opaque.","next_experiment":"Audit one command against AXI without behavior changes."},{"id":"lavish-axi","name":"lavish-axi","authority_url":"https://github.com/kunchenguid/lavish-axi","category":"review_surface","dispositions":["use","integrate","reference_only"],"tracking":"follow_latest_before_adoption","adoption_status":"candidate","authority":"Local HTML review, annotation, Mermaid editing, and agent polling.","continuum_role":"Optional visual review for architecture and sprint artifacts.","adoption_boundary":"Annotations remain untrusted input until captured in a bounded task.","observed_ref":"v0.1.40 observed 2026-07-12","risk":"Polished review can be mistaken for validation.","next_experiment":"Review one generated map and preserve accepted annotation provenance."},{"id":"no-mistakes","name":"no-mistakes","authority_url":"https://github.com/kunchenguid/no-mistakes","category":"validation_gate","dispositions":["use","evaluate","emulate"],"tracking":"follow_latest_before_adoption","adoption_status":"candidate","authority":"Local git proxy and disposable-worktree validation pipeline.","continuum_role":"Optional delivery gate; emulate fail-closed checks and safe repair.","adoption_boundary":"Continuum topology and repo validators remain authoritative.","observed_ref":"v1.34.0 observed 2026-07-12","risk":"A proxy can conflict with repo checks or obscure mutation ownership.","next_experiment":"Evaluate one docs-only branch and compare evidence models."},{"id":"gnhf","name":"gnhf","authority_url":"https://github.com/kunchenguid/gnhf","category":"orchestrator","dispositions":["evaluate","emulate","defer"],"tracking":"follow_latest_before_adoption","adoption_status":"deferred","authority":"Long-running iterative agent loop and rollback behavior.","continuum_role":"Emulate bounded journals, caps, rollback, and one-change discipline.","adoption_boundary":"No live autonomous mutation before leases, budgets, adapters, and stop proof.","observed_ref":"v0.1.42 observed 2026-07-12","risk":"Persistent loops can compound errors or collide with work.","next_experiment":"Model a non-mutating three-iteration fixture."},{"id":"treehouse","name":"treehouse","authority_url":"https://github.com/kunchenguid/treehouse","category":"agent_tooling","dispositions":["use","evaluate","emulate"],"tracking":"follow_latest_before_adoption","adoption_status":"candidate","authority":"Reusable isolated-worktree pool and cache-preserving mechanics.","continuum_role":"Potential implementation behind Continuum worktree leases and topology.","adoption_boundary":"Verify ownership, branch, HEAD, dirty state, and operations before reuse.","observed_ref":"v2.0.0 observed 2026-07-12","risk":"Workspace reuse can leak stale state without leases.","next_experiment":"Compare in-use detection with Continuum floor and lease requirements."},{"id":"firstmate","name":"firstmate","authority_url":"https://github.com/kunchenguid/firstmate","category":"orches